{
  "$schema": "https://json-schema.org/draft/2020-12/schema",
  "$id": "urn:ics:schema:pointing-model:v1",
  "title": "ICS pointing model",
  "description": "A station mount's pointing model, fitted to stars by python/ics_models/pointing (ICS-035) and loaded by the C++ encoder module (ICS-036). The line of sight is sky = encoder + sum(value_rad * basis(name, encoder)), with each term's basis as python/ics_models/pointing/model.py defines it and golden/pointing pins it. Angles are in radians: azimuth from north through east, elevation up from the horizon. See schemas/README.md.",
  "type": "object",
  "additionalProperties": false,
  "required": [
    "format",
    "format_version",
    "model_id",
    "station_id",
    "created_utc",
    "site",
    "terms",
    "fit",
    "observations_sha256"
  ],
  "properties": {
    "format": {
      "description": "What this file is.",
      "const": "ics-pointing-model"
    },
    "format_version": {
      "description": "The version of this format: 1.",
      "const": 1
    },
    "model_id": {
      "description": "The model's own name, unique per station, for example the station and the night's date.",
      "type": "string",
      "minLength": 1
    },
    "station_id": {
      "description": "The station, as named in the range configuration.",
      "type": "string",
      "minLength": 1
    },
    "created_utc": {
      "description": "When the model was fitted, ISO 8601 in UTC.",
      "type": "string",
      "pattern": "^[0-9]{4}-[0-9]{2}-[0-9]{2}T[0-9]{2}:[0-9]{2}:[0-9]{2}(\\.[0-9]+)?Z$"
    },
    "site": {
      "description": "Where the station is: geodetic WGS84 latitude and longitude, east positive, and height above the ellipsoid.",
      "type": "object",
      "additionalProperties": false,
      "required": ["latitude_deg", "longitude_deg", "height_m"],
      "properties": {
        "latitude_deg": {"type": "number", "minimum": -90, "maximum": 90},
        "longitude_deg": {"type": "number", "minimum": -180, "maximum": 180},
        "height_m": {"type": "number"}
      }
    },
    "terms": {
      "description": "The model's terms, in the order they were fitted; each name at most once.",
      "type": "array",
      "minItems": 1,
      "items": {
        "type": "object",
        "additionalProperties": false,
        "required": ["name", "value_rad", "sigma_rad"],
        "properties": {
          "name": {
            "description": "The term's TPOINT name.",
            "enum": ["IA", "IE", "CA", "NPAE", "AN", "AW", "TF", "HASA", "HACA", "HASA2", "HACA2", "HESA", "HECA", "HESA2", "HECA2", "HESE"]
          },
          "value_rad": {"description": "The coefficient, in radians.", "type": "number"},
          "sigma_rad": {"description": "Its standard deviation from the fit, in radians.", "type": "number", "minimum": 0}
        }
      }
    },
    "fit": {
      "description": "How the fit went. C17 is held_out_rms_urad: the on-sky RMS on stars the fit never saw.",
      "type": "object",
      "additionalProperties": false,
      "required": ["stars_used", "stars_rejected", "rms_urad", "stars_held_out", "held_out_rms_urad"],
      "properties": {
        "stars_used": {"type": "integer", "minimum": 1},
        "stars_rejected": {"type": "integer", "minimum": 0},
        "rms_urad": {"type": "number", "minimum": 0},
        "stars_held_out": {"type": "integer", "minimum": 1},
        "held_out_rms_urad": {"type": "number", "minimum": 0}
      }
    },
    "observations_sha256": {
      "description": "The SHA-256 of the observation file the model was fitted to.",
      "type": "string",
      "pattern": "^[0-9a-f]{64}$"
    }
  }
}
